{
  "schemaVersion": 1,
  "name": "staging",
  "accountId": "374784ce2915a597adcecf9bcb2c5ee6",
  "prefix": "frockbot",
  "authPackage": "better-auth",
  "workers": {
    "app": {
      "name": "frockbot-cloudflare-staging",
      "hostnames": ["staging-bot.frockbot.com"]
    },
    "computerHost": {},
    "appletBuild": {}
  },
  "resources": {
    "applicationArtifactsBucket": "frockbot-application-artifacts-staging",
    "memoryFilesBucket": "frockbot-memory-files-staging",
    "memoryIndex": "frockbot-memory-staging",
    "authDatabaseName": "frockbot-auth-staging"
  },
  "nativeApps": {
    "android": [
      {
        "packageName": "com.frockbot.mobile",
        "sha256CertFingerprints": [
          "61:E6:47:9F:9C:57:55:15:4C:1F:93:9C:DE:48:E8:A7:57:EF:F3:13:6E:54:ED:1D:DA:5F:61:E7:8B:3C:1E:37"
        ]
      }
    ],
    "apple": ["Q444L76529.com.frockbot.mobile"]
  },
  "aiGateway": {
    "accountId": "374784ce2915a597adcecf9bcb2c5ee6"
  }
}
